,rank,song_name,song_id,artist_name,artist_id,alb_name,alb_id
0,1,에잇(Prod.&Feat. SUGA of BTS),32578498,아이유,261143,에잇,10426648
1,2,아로하,32491274,조정석,253606,슬기로운 의사생활 OST Part 3,10409054
2,3,사랑하게 될 줄 알았어,32614125,전미도,683172,슬기로운 의사생활 OST Part 11,10433754
3,4,깡 Official Remix,32646938,식케이 (Sik-K),786648,깡 Official Remix,10439549
4,5,MORE & MORE,32636656,TWICE (트와이스),905701,MORE & MORE,10437786
5,6,살짝 설렜어 (Nonstop),32559781,오마이걸 (OH MY GIRL),857994,NONSTOP,10423289
6,7,나비와 고양이 (feat.백현 (BAEKHYUN)),32583036,볼빨간사춘기,792022,사춘기집Ⅱ 꽃 본 나비,10427559
7,8,좋은 사람 있으면 소개시켜줘,32473998,조이 (JOY),780922,슬기로운 의사생활 OST Part 2,10405712
8,9,"너에게 난, 나에게 넌",32631950,미도와 파라솔,2869463,슬기로운 의사생활 OST Part 12,10436942
9,10,시작,32345931,가호 (Gaho),13494,이태원 클라쓰 OST Part.2,10381712
10,11,화려하지 않은 고백,32508146,규현 (KYUHYUN),205880,슬기로운 의사생활 OST Part 4,10412335
11,12,처음처럼,32486613,엠씨더맥스 (M.C the MAX),161636,CEREMONIA,10408131
12,13,Dance Monkey,31979846,Tones And I,2742009,The Kids Are Coming,10316394
13,14,Dolphin,32559782,오마이걸 (OH MY GIRL),857994,NONSTOP,10423289
14,15,아무노래,32313543,지코 (ZICO),602056,아무노래,10375118
15,16,흔들리는 꽃들 속에서 네 샴푸향이 느껴진거야,32003395,장범준,648551,멜로가 체질 OST Part 3,10320500
16,17,Memories,32055419,Maroon 5,107721,JORDI (Deluxe),10330593
17,18,ON,32399830,방탄소년단,672375,MAP OF THE SOUL : 7,10377346
18,19,METEOR,32224272,창모 (CHANGMO),774900,Boyhood,10359162
19,20,Blueming,32183386,아이유,261143,Love poem,10346650
20,21,어떻게 지내 (Prod. By VAN.C),32438894,오반,925515,어떻게 지내,10399190
21,22,그대 고운 내사랑,32521396,어반자카파,420527,슬기로운 의사생활 OST Part 5,10415229
22,23,덤더럼 (Dumhdurum),32528369,Apink (에이핑크),534360,LOOK,10416723
23,24,Candy,32620700,백현 (BAEKHYUN),672859,Delight - The 2nd Mini Album,10434955
24,25,Don't Start Now,32137576,Dua Lipa,889721,Future Nostalgia,10345880
25,26,작은 것들을 위한 시 (Boy With Luv) (Feat. Halsey),31737197,방탄소년단,672375,MAP OF THE SOUL : PERSONA,10273641
26,27,내 눈물 모아,32561690,휘인 (Whee In),756533,슬기로운 의사생활 OST Part 8,10423707
27,28,마음을 드려요,32378104,아이유,261143,사랑의 불시착 OST Part 11,10388744
28,29,2002,31029291,Anne-Marie,870307,Speak Your Mind (Deluxe),10137250
29,30,늦은 밤 너의 집 앞 골목길에서,32156286,노을,105623,늦은 밤 너의 집 앞 골목길에서,10348811
30,31,그때 그 아인,32377231,김필,561051,이태원 클라쓰 OST Part.6,10388581
31,32,돌덩이,32361098,하현우 (국카스텐),612072,이태원 클라쓰 OST Part.3,10385262
32,33,이제 나만 믿어요,32508053,임영웅,994944,내일은 미스터트롯 우승자 특전곡,10412319
33,34,너를 사랑하고 있어,32298623,백현 (BAEKHYUN),672859,낭만닥터 김사부 2 OST Part.1,10372655
34,35,Psycho,32273582,Red Velvet (레드벨벳),780066,‘The ReVe Festival’ Finale,10368053
35,36,오늘도 빛나는 너에게 (To You My Light) (Feat.이라온),31853557,마크툽 (MAKTUB),566431,Red Moon : To You My Light,10294603
36,37,Happy,32572926,태연 (TAEYEON),236797,Happy,10425647
37,38,"어떻게 이별까지 사랑하겠어, 널 사랑하는 거지",32061975,AKMU (악뮤),712452,항해,10331947
38,39,Maniac,32122539,Conan Gray,2398189,Maniac,10343276
39,40,취했나봐,32616054,황인욱,1865473,취했나봐,10434085
40,41,WANNABE,32445339,ITZY (있지),2622030,IT'z ME,10400522
41,42,반만,32224409,진민호,695512,반만,10359204
42,43,깡,30764790,비,17671,MY LIFE愛,10114544
43,44,"모든 날, 모든 순간 (Every day, Every Moment)",30962526,폴킴,752425,'키스 먼저 할까요?' OST Part.3,10149492
44,45,어떻게 지내 (답가),32650659,런치,2746396,어떻게 지내 (답가),10440301
45,46,우리 만남이,32550314,폴킴,752425,"정규 2집 '마음, 둘'",10421264
46,47,00:00 (Zero O’Clock),32399832,방탄소년단,672375,MAP OF THE SOUL : 7,10377346
47,48,우리 왜 헤어져야 해,32187544,신예영,2740042,우리 왜 헤어져야 해,10353881
48,49,FIESTA,32381408,IZ*ONE (아이즈원),2398653,BLOOM*IZ,10389281
49,50,Black Swan,32323969,방탄소년단,672375,MAP OF THE SOUL : 7,10377346
50,51,안녕,31984204,폴킴,752425,호텔 델루나 OST Part.10,10317137
51,52,Lonely Night,32455023,권진아,760046,슬기로운 의사생활 OST Part 1,10401953
52,53,찐이야,32457751,영탁,753762,내일은 미스터트롯 결승전 베스트,10402513
53,54,Love poem,32143487,아이유,261143,Love poem,10346650
54,55,Stuck with U,32584913,Ariana Grande,597451,Stuck with U,10428037
55,56,사랑은 지날수록 더욱 선명하게 남아,32651098,전상근,979724,한 걸음 : 흔적,10440381
56,57,친구,32399834,방탄소년단,672375,MAP OF THE SOUL : 7,10377346
57,58,Paris In The Rain,31341518,Lauv,1956543,I met you when I was 18. (the playlist),10209752
58,59,HIP,32175937,마마무 (Mamamoo),750053,reality in BLACK,10351886
59,60,밤이 깊었네 (Drama Ver.),32596760,미도와 파라솔,2869463,슬기로운 의사생활 OST Part 10,10430453
60,61,품,32594046,볼빨간사춘기,792022,사춘기집Ⅱ 꽃 본 나비,10427559
61,62,너를 그린 우주 (Insomnia2020) (Feat. 이라온),32556676,마크툽 (MAKTUB),566431,Red Moon : SUPERNOVA,10422586
62,63,작사가,32665408,헤이즈 (Heize),751611,Lyricist,10442336
63,64,bad guy,31701428,Billie Eilish,1239008,"WHEN WE ALL FALL ASLEEP, WHERE DO WE GO?",10267565
64,65,Filter,32399827,방탄소년단,672375,MAP OF THE SOUL : 7,10377346
65,66,To Die For,32373713,Sam Smith,718042,To Die For,10387838
66,67,Moon,32399835,방탄소년단,672375,MAP OF THE SOUL : 7,10377346
67,68,어느 60대 노부부이야기,32397381,임영웅,994944,내일은 미스터트롯 트롯 에이드 베스트,10391899
68,69,봄날,30244931,방탄소년단,672375,YOU NEVER WALK ALONE,10037969
69,70,너에게 가는 이 길 위에서 (너.이.길),32421335,백현 (BAEKHYUN),672859,하이에나 OST Part.2,10396078
70,71,자나깨나 (Feat. 조이 of Red Velvet),32607375,Crush,674710,homemade 1,10432576
71,72,니가 왜 거기서 나와 (Narr. 고은아),31368699,영탁,753762,니가 왜 거기서 나와,10214084
72,73,Stay Tonight,32559498,청하,968265,Stay Tonight,10423202
73,74,시차,32399828,방탄소년단,672375,MAP OF THE SOUL : 7,10377346
74,75,Bungee,32620702,백현 (BAEKHYUN),672859,Delight - The 2nd Mini Album,10434955
75,76,Painkiller,31768993,Ruel,1438336,Painkiller,10279656
76,77,We are Bulletproof : the Eternal,32399837,방탄소년단,672375,MAP OF THE SOUL : 7,10377346
77,78,12:45 (Stripped),31509376,Etham,1907334,12:45 (Stripped),10235362
78,79,Inner Child,32399833,방탄소년단,672375,MAP OF THE SOUL : 7,10377346
79,80,Love Again,32620706,백현 (BAEKHYUN),672859,Delight - The 2nd Mini Album,10434955
80,81,안녕과 안녕으로,32636587,이예준,718655,안녕과 안녕으로,10437780
81,82,바램,32323330,임영웅,994944,내일은 미스터트롯 예선곡 베스트,10377157
82,83,Louder than bombs,32399829,방탄소년단,672375,MAP OF THE SOUL : 7,10377346
83,84,너를 만나,31388145,폴킴,752425,너를 만나,10217134
84,85,욱 (UGH!),32399831,방탄소년단,672375,MAP OF THE SOUL : 7,10377346
85,86,사랑이란 멜로는 없어,32034629,전상근,979724,사랑이란 멜로는 없어,10326710
86,87,시든 꽃에 물을 주듯,31703498,HYNN (박혜원),1229685,시든 꽃에 물을 주듯,10267986
87,88,조금 취했어 (Prod. 2soo),32059630,임재현,2087273,조금 취했어,10331499
88,89,일이 너무 잘 돼,32665409,헤이즈 (Heize),751611,Lyricist,10442336
89,90,Interlude : Shadow,32399826,방탄소년단,672375,MAP OF THE SOUL : 7,10377346
90,91,Obsession,32217921,EXO,724619,OBSESSION - The 6th Album,10357878
91,92,Birthday,32362644,Anne-Marie,870307,Birthday,10385597
92,93,Outro : Ego,32399838,방탄소년단,672375,MAP OF THE SOUL : 7,10377346
93,94,"다시 난, 여기",32311870,백예린 (Yerin Baek),698776,사랑의 불시착 OST Part 4,10374783
94,95,"Yours (Feat. 이하이, 창모)",32590490,Raiden,1383091,"Yours (Feat. 이하이, 창모)",10429159
95,96,"사랑, 하자",32495729,수호 (SUHO),672855,자화상 - The 1st Mini Album,10409970
96,97,Respect,32399836,방탄소년단,672375,MAP OF THE SOUL : 7,10377346
97,98,포장마차,31873020,황인욱,1865473,포장마차,10298014
98,99,Poppin',32620704,백현 (BAEKHYUN),672859,Delight - The 2nd Mini Album,10434955
99,100,Square (2017),32243273,백예린 (Yerin Baek),698776,Every letter I sent you.,10362776
